"00epRVQxl0zUrkUCJFvAJ7","Hip Hop Classics by WAX TAILOR","100 hip hop classics in chronological order from 1985 to 2005 with one rule, never 2 tracks on the same album. ","https://i.scdn.co/image/ab67706c0000bebb759c1e0e1d2705f87398560a","waxtailorofficial","Wax Tailor","user"
"0B3WoheGNqol1B69LM9Y8n","Minimal Techno","Melodic. Progressive. Timeless. Minimal. Techno.","https://i.scdn.co/image/ab67706c0000bebbbcd602f12ea98118fdd5353d","alekzanther","alekzanther","user"
"0CVT44Q3aur9PPQUbsu4r1","Melodic House & Techno","Club ready  melodic house &amp; techno","https://i.scdn.co/image/ab67706c0000bebb7fd3e7b85c739b70191f87fe","noraenpure","Nora En Pure","user"
"0G1zBHvFTwLyFRuCM0DtGc","Layton Giordani's Mind Language ","&#x27;Mind Language&#x27; An updated Techno playlist of Layton Giordani&#x27;s favorite tracks of the moment. ","https://i.scdn.co/image/ab67706c0000bebb5b97be43abb6789721f7ab34","r0p4vcd6ws9h0c6ui15g12q0o","Layton Giordani","user"
"0PboxeWzzcHwqsizS1AP8j","Psychedelic Electronic","hard to define but this is my version of it &#x2F;&#x2F;&#x2F; soundcloud trax: Burial &amp; Four Tet - Nova, Clams Casino - I&#x27;m God, Jake Chudnow - Olive, Bloom [Jamie XX Rework Part3]","https://i.scdn.co/image/ab67706c0000bebbffa9d8f8a52801ef977d0adf","1110084508","Benjamin Hasselberg","user"
"0SRXlkPPgKUQfj4B28dMI4","Essential War Metal","","https://mosaic.scdn.co/640/ab67616d0000b2730aac06a445fa7381ba2131eaab67616d0000b27399e00622dd56082ea2649327ab67616d0000b273b045a3e4dacedf2976304caeab67616d0000b273f1333c351c5f2bcce81d048f","1187058818","Michał 'Neithan' Kiełbasa","user"
"0WIshYTu19fhto8LDxS0rV","Fav Krautrock X","","https://mosaic.scdn.co/640/ab67616d0000b273168500210f4af0d9b8c36b74ab67616d0000b2734a87e661189b7c20e9013f41ab67616d0000b273a73907c8286d2b7651bd2a5aab67616d0000b273b7cc2b918242fb4ac5012350","1187058818","Michał 'Neithan' Kiełbasa","user"
"0aKdqLs5wf1EArbaMdAunS","Purified by Nora En Pure","Tracks from my radioshow, stuff I play and recent releases from Enormous Tunes, Purified Records and more...","https://i.scdn.co/image/ab67706c0000bebb22bffd6774fe270fbb2804e0","noraenpure","Nora En Pure","user"
"0aUHXLjLoyw0cfDTayFVg9","MELODIC TECHNO 2023","Number #1 Best Melodic Techno Playlist on Spotify! 🔥 Don't forget to follow the playlist. Enjoy! 💜🎉 | <a href=""https://www.instagram.com/widerbergmusic/"">Follow on Instagram</a>","https://i.scdn.co/image/ab67706c0000bebbc649d911f6da5b8e7e68cc85","biavucyalnizlik","widerberg","user"
"0dgLZd6WLwMbrhwgm03qyn","DUB TECHNO","","https://i.scdn.co/image/ab67706c0000bebb79acaf6053809f9a64e6f5e4","pulshar","Pulshar","user"
"0iCuzAER8gjEjq9sdVkdx1","The Sound of Abstract IDM","See also <a href=""spotify:playlist:1cNeJBWPHEmC4rAAiS2IJ0"">Intro</a>, <a href=""spotify:playlist:0MHFbLlzoQF1L86Q5aAtQn"">Pulse</a>, <a href=""spotify:playlist:6HeFejLsRbo7hV0DMnMy2j"">Edge</a> or <a href=""spotify:playlist:48P8T9HKOQx9ox0eS4X9IH"">2022</a>; or the Sounds of <a href=""spotify:playlist:5haig3RZ6OcU4Cz6AukvXY"">Ambient IDM</a>, <a href=""spotify:playlist:7nC4B9gtrOBQ7aT1J7FiOt"">UK Experimental Electronic</a>, <a href=""spotify:playlist:3U4NUWEMSqoTI0TBcD0QHU"">Ukrainian Experimental</a>, <a href=""spotify:playlist:2Ir5MP20VzC5Aj62CBd2xW"">Experimental Electronic</a>, <a href=""spotify:playlist:1iAyidkrH72ukfG3BSHTqL"">Fluxwork</a>, <a href=""spotify:playlist:3uwJeZkSKE219OiTdOV0b0"">Deconstructed Club</a>, <a href=""spotify:playlist:6R9NIMDGt0sK7k1EggBAhj"">Vaporwave</a>, <a href=""spotify:playlist:3latkPrUCKAReX6bA9cEBw"">Neo-Kraut</a>, <a href=""spotify:playlist:3P9lEX8RzKkD3hNVvnoMc5"">Intelligent Dance Music</a> or <a href=""spotify:playlist:7C8E5QgIfbJXb55XOrhe3b"">Polish Experimental Electronic</a>; or much more at <a href=""http://everynoise.com"">everynoise.com</a>.","https://i.scdn.co/image/ab67706c0000bebb742e19a0442c57e6b7ff85f3","thesoundsofspotify","The Sounds of Spotify","user"
"0muChDcfpUFAOBmaNtqqxs","Doom metal & post black metal","If you enjoy blast beats and double bass equallly. The best of both worlds.","https://i.scdn.co/image/ab67706c0000bebb2d9ecd92a781289d58fbd591","22qiln2s76dmynoprq6fowkya","Rise to the Sky","user"
"0zWcfPRGU4GI2sQSIuwu4j","Deep House Workout","The greatest and finest deep house music for your workout !","https://i.scdn.co/image/ab67706c0000bebbed8bdf42bb2a0ff68674ecb1","supersquared","supersquared","user"
"175ZwXBOYEF0NpJuXxC2Qc","Melodic Techno 2023","The best new Melodic Techno curated by Mark Tarmonea &amp; Eye And Eye","https://i.scdn.co/image/ab67706c0000bebbcfc1febaad8520bf3e4928f9","4tiijqi9j13q9wvazg7pq3mqi","Eye And Eye Recordings","user"
"18vUeZ9BdtMRNV6gI8RnR6","Techno Music 2023 💊","updated regularly. non stop the best techno songs - deep techno - best techno playlist - melodic techno hits - hard techno tracks - non stop techno - best tecno - best tekno","https://i.scdn.co/image/ab67706c0000bebb9d3e27d776112e747409b54b","21ifzjxggdajdpc4w6iqxslkq","Soave","user"
"1S0RMYNgC6f0VKO3FjuXwo","Dark Techno & Minimal House 2023","|Brollovic_Records (IG) -&gt; For requests| Techno Tech Techhouse House Minimal Boris Brejcha Tom Hutt Spektre Stan Kolev Joyhauser Amelie Lens Umek progressive Acid Trip Fitness Gym Motivation Uptempo Hidden Empire Rave Festival de Witte Christian Craken de witte deborah de luca","https://i.scdn.co/image/ab67706c0000bebb51b376ce00eb8cf26ab763cf","tim.broll","Brollovic Records","user"
"1fRhl9b7aw0bFWU1CMlWVR","pov: u’re a blade runner","you’re walking in the darkests of nights, tears in rain with colors looping all around you. (ig: staticspaceelover if you want to add songs)","https://i.scdn.co/image/ab67706c0000bebba2c855cb18b43227f2fc5eae","ms5filoc9qv8gpuiexcuuo3gw",":^)","user"
"1yxLAI1lIDmkRmEYCp2tTv","DARK AMBIENT textures X","","https://mosaic.scdn.co/640/ab67616d0000b273575e0cffc98a6dfbad55e82fab67616d0000b273643d739a5cc92141174c0db1ab67616d0000b273a54c0917071e898440a30cefab67616d0000b273a64533e157168e1527c89e80","1187058818","Michał 'Neithan' Kiełbasa","user"
"1zPt4sDjC9r3SNctcmL6gU","Top 10 influential movie themes","Here are some soundtracks that moved and inflenced me through the years. I hope you enjoy them like I do.","https://i.scdn.co/image/ab67706c0000bebbf96da9c5e036beeee58e3c37","12139436707","Sandra Téléski","user"
"1zrZ4wDRs3Nhrykv5rQaJO","Deborah De Luca / TECHNO DAYS","..these are my personal favorite tracks of the month","https://i.scdn.co/image/ab67706c0000bebbfe89da6b1a9962cd6c1d0520","deborahdelucadj","deborahdelucadj","user"
"23NIjYZgFd5V2moB22Rsl1","Focus | Upbeat","Audio caffeine. Upbeat music to work to. The rules: no vocals apart from minimal samples or non-English words; head-bopping tempo; no attention-seeking guitar solos or rock gymnastics; no distractions.","https://i.scdn.co/image/ab67706c0000bebb71c92ef465e4ddbc42a9d4e3","jimmykonty","jimmykonty","user"
"2B8zE3BZbKV9x97KOJ4y75","Berghain Techno","instagram.com&#x2F;schmelixschmus","https://i.scdn.co/image/ab67706c0000bebb63c74abe0e207bd03aa8c78f","weedinjector","weedinjector","user"
"2NQTkD1v77oNrMF0YjHv9F","GOTHIC ROCK for all X","","https://mosaic.scdn.co/640/ab67616d0000b27335b601e70c8c36e0704c1219ab67616d0000b2736a1e50b8bbc94a459ac9ec36ab67616d0000b27380fb3335ca3eff46e93b1039ab67616d0000b273e487374389cbc3952639a80b","1187058818","Michał 'Neithan' Kiełbasa","user"
"2OErp2eJbU5NqNMx7iudOc","This Is Terminal M Records","Monika Kruse&#x27;s label","https://i.scdn.co/image/ab67706c0000bebb85a1881c8dd5e19bfff79122","b0wc2q2f6unpsvhh0l343vtwy","Terminal M Records","user"
"2Q1NuuQL4wTCZ3afgvpXgp","INDUSTRIAL IS DEATH X","","https://mosaic.scdn.co/640/ab67616d0000b2736b11da87da022407e4646214ab67616d0000b2738bf9998d91ac8ccb9c5bdd89ab67616d0000b273a02122d225e4f410a4b64a9cab67616d0000b273fd1eb73b4afa506b42222e6a","1187058818","Michał 'Neithan' Kiełbasa","user"
"2VP2dbD0p63Iu1oaZalIgr","Hidden Empire _ Inspirational","Music we like to listen to and that inspire us.","https://i.scdn.co/image/ab67706c0000bebb0811ac9ad9f675d94c6e9993","3e2i90es61vtiah3574u1dclj","Hidden Empire","user"
"2XKw91GNetI0NauCjbrbVo","Thomas Schumacher NOW","This is a playlist that I frequently update. It reflects what I am playing my sets.","https://i.scdn.co/image/ab67706c0000bebb1a1625b5570c977f8e13ad9e","1124917986","Thomas Schumacher","user"
"2eepGxUYSGco58Cn64hX3C","LIFE IS DOOM X","","https://mosaic.scdn.co/640/ab67616d0000b27349d444e0fd14985c47128a7fab67616d0000b273785ceb871d7949fa3036d490ab67616d0000b273bebe15c7ac4ab7c59f7987f1ab67616d0000b273c8bdddbfbd536a8ca586af4e","1187058818","Michał 'Neithan' Kiełbasa","user"
"2jFuFpI503n5qbn5YybeuG","Various Faces of BLACK METAL","","https://mosaic.scdn.co/640/ab67616d0000b2732b58dcaa52f824711a95ab1bab67616d0000b27333d902bed9cf65ddc21e3829ab67616d0000b2735703e06509829606e853884bab67616d0000b2738f636665704bb33e9deb1c9e","1187058818","Michał 'Neithan' Kiełbasa","user"
"2ldcJjPy7eNz65YoD76Y4k","LOFI HEROES","","https://i.scdn.co/image/ab67706c0000bebb3177bf7cb8bda92bb03318fa","pulshar","Pulshar","user"
"2lqYnxVJyFXxJNNBGGTG3H","Funeral Doom Metal / Death Doom","Masterpieces of Funeral&#x2F;Death&#x2F;Atmospheric Doom.  Some Melodic&#x2F;Traditional&#x2F;Blackened Doom Metal.  Always adding new stuff!","https://i.scdn.co/image/ab67706c0000bebb6d4cec5ffb59d7348093d92c","22qiln2s76dmynoprq6fowkya","Rise to the Sky","user"
"2zYZRiXIyWb5JiXQIGHrhd","Doom Folk","A mix of folk, bluegrass, and acoustic black &amp; doom metal. Channeling dark and gothic sounds from diverse artists. Themes of death, nature, love and loss, and revolution. (playlist photo: H.E. Deutsch, 1936)","https://i.scdn.co/image/ab67706c0000bebba00a5c35e27e026015f2d324","5k3mohr6akffpretd2isajlrx","Nat","user"
"33SyxQJiXNzb2I1uG87n0n","drone doom X","","https://mosaic.scdn.co/640/ab67616d0000b27333d39698b74d27f99878ace5ab67616d0000b2735ad2304d1e21ce329e5d3995ab67616d0000b2736da79ce4a0a2c682a41bf9bdab67616d0000b273bccac457458eb28402004e39","1187058818","Michał 'Neithan' Kiełbasa","user"
"37i9dQZF1DWSFNWN7fsnAm","MK's track IDs","Listen to <a href=""spotify:artist:1yqxFtPHKcGcv6SXZNdyT9"">MK</a>'s favorite tracks. Updated regularly. More track IDs <a href=""spotify:genre:track_id"">here</a>.","https://i.scdn.co/image/ab67706f00000003f9da121cd77632eb0d61c6f2","spotify","Spotify","user"
"37i9dQZF1DWSHhwkucwkT0","Desiree's DJ Mix","The South African DJ Desiree delivers an elegant mix that blends Afro-House and Deep-Tech","https://i.scdn.co/image/ab67706f0000000374ea1dca4adb0f59cd1f72e7","spotify","Spotify","user"
"37i9dQZF1DWSM6VFl9k2Ba","Joplyn's DJ Mix","Emerging DJ & producer <a href=""spotify:artist:32Jt1AK733JbFR82hEZ0Ih"">Joplyn</a> brings us palette of underground sounds.","https://i.scdn.co/image/ab67706f00000003e0553963442d9d289cbb2136","spotify","Spotify","user"
"37i9dQZF1DWSQxGzwb8MDD","Monster's track IDs","Monsters's favorite tracks. Updated regularly. Curated by Monster. Discover more track IDs playlists <a href=""spotify:genre:track_id"">here</a>.
","https://i.scdn.co/image/ab67706f00000003dcee656e2175ea488677471c","spotify","Spotify","user"
"37i9dQZF1DWSXhGIsh9lqr","ANNA's DJ Mix","Brazilian DJ and Producer <a href=""spotify:artist:3wkaDi2HJV3eCaBJ4iH6om"">ANNA</a> delivers a high-energy Techno mix.","https://i.scdn.co/image/ab67706f0000000326bc09902fd89fe2feca7dcb","spotify","Spotify","user"
"37i9dQZF1DWSggqNUNxI08","Yu Su's track IDs","<a href=""spotify:artist:69zPIMRgsZieOHFtHtvnj0"">Yu Su</a>'s favorite tracks. Updated regularly. Curated by Yu Su. Discover more track IDs playlists <a href=""spotify:genre:track_id"">here</a>.","https://i.scdn.co/image/ab67706f00000003de0af861f3d1f72868ed24a6","spotify","Spotify","user"
"37i9dQZF1DWSlskcBvOTt0","Tantra","Hypnotic melodic <a href=""spotify:genre:house"">house</a> and <a href=""spotify:genre:techno"">techno</a> to light up the night.","https://i.scdn.co/image/ab67706f00000003bf96081b442f717b7756b5b8","spotify","Spotify","user"
"37i9dQZF1DWSluyUi4YGjq","Shoegaze Now","A new gen of bands gazing at their pedals, while soaring celestially-high. julie on cover!","https://i.scdn.co/image/ab67706f000000034f34c58a2c1c5ac898fb2198","spotify","Spotify","user"
"37i9dQZF1DWSnDyPAn5upE","ethereal voices","Otherworldly voices in the realms of ambient. Cover: Grouper","https://i.scdn.co/image/ab67706f00000003911dbc521ff00fd5a5787627","spotify","Spotify","user"
"37i9dQZF1DWSnqDRRcBlDX","Amelie Lens' track IDs","<a href=""spotify:artist:5Ho1vKl1Uz8bJlk4vbmvmf"">Amelie Lens</a>' favorite tracks. Updated regularly. Curated by Amelie Lens. More track IDs <a href=""spotify:genre:track_id"">here</a>.","https://i.scdn.co/image/ab67706f0000000391bde876649ebcee2ff1e518","spotify","Spotify","user"
"37i9dQZF1DWSsObZRzO8Xw","Math Rock","Welcome to the universe of complex rhythms and mesmerizing loops. Cover: toe","https://i.scdn.co/image/ab67706f00000003b6e39a1864d76fa55bf38ca1","spotify","Spotify","user"
"37i9dQZF1DWSsQxABZdOtf","Nina Las Vegas' track IDs","<a href=""spotify:artist:3L2tOP2vRYfjXVW4W1tKEJ"">Nina Las Vegas'</a> favourite tracks. Updated regularly. Curated by Nina Las Vegas. More track IDs <a href=""spotify:genre:track_id"">here</a>.","https://i.scdn.co/image/ab67706f000000035c0201634069acce0091fb66","spotify","Spotify","user"
"37i9dQZF1DWT0upuUFtT7o","Fresh Finds Indie","The best new indie tracks from independent artists & labels. Updates every Wednesday. Cover: Noah Pope","https://i.scdn.co/image/ab67706f000000034e370b699deb0c82b2687c67","spotify","Spotify","user"
"37i9dQZF1DWT2jS7NwYPVI","New Noise","Your cheat sheet for everything on the rise in the rock/alt world. Cover: grandson","https://i.scdn.co/image/ab67706f000000034f61cb4c9cc990eb710c178d","spotify","Spotify","user"
"37i9dQZF1DWT8HFs5xP010","Ken Ishii's track IDs","<a href=""spotify:artist:0Jb1cpfG4GB6pZfroFhAw0"">Ken Ishii</a>'s favorite tracks. Updated regularly. Curated by Ken Ishii. More track IDs <a href=""spotify:genre:track_id"">here</a>.","https://i.scdn.co/image/ab67706f00000003ba3f6401d44705b7c67dc449","spotify","Spotify","user"
"37i9dQZF1DWTA9xrja5XU1","Slushii's DJ Mix","<a href=""spotify:artist:41rVuRHYAiH7ltBTHVR9We"">Slushii</a> drops a colorful mix full of rumbling bass and head banging tunes.","https://i.scdn.co/image/ab67706f000000032b74141c51b438dd25717efe","spotify","Spotify","user"
"37i9dQZF1DWTETgNEeTR8L","Adam Beyer DJ Mix: Drum Codes","Techno legend <a href=""spotify:artist:1btv9qmIpbp7q1ixCYNdHu"">Adam Beyer</a> delivers a stunning masterpiece. ","https://i.scdn.co/image/ab67706f000000035f85825c2c4a372c4e529506","spotify","Spotify","user"
"37i9dQZF1DWTP5wXz7Mvlg","DJ Marky's track IDs","<a href=""spotify:artist:1rd51IrbtX9DqoU0Zxu4TV"">DJ Marky</a>'s favourite tracks. Updated regularly. Curated by DJ Marky. More track IDs <a href=""spotify:genre:track_id"">here</a>.","https://i.scdn.co/image/ab67706f000000033a6be3c11957f3b6223ff1d3","spotify","Spotify","user"
"37i9dQZF1DWTPIUY9wJIcE","OLAN's DJ Mix","The up-and-coming DJ & producer OLAN delivers a blend of breakbeats and electronica while showcasing her new album, Contra.","https://i.scdn.co/image/ab67706f00000003beb9f3ac354688dddab97473","spotify","Spotify","user"
"37i9dQZF1DWTQHB0vBt1AG","Daphni's track IDs","<a href=""spotify:artist:4nhvb6x9ZhPiYCzrHDNia9"">Daphni</a>'s track IDs. Updated regularly. Curated by Daphni. Discover more track IDs playlists <a href=""spotify:genre:track_id"">here</a>.","https://i.scdn.co/image/ab67706f00000003df4932b72be35b7d9c15d433","spotify","Spotify","user"
"37i9dQZF1DWTR6lD3pmkqP","21st Century Jazz","The sound of the new era of Jazz. Cover: Esperanza Spalding","https://i.scdn.co/image/ab67706f00000003c40bd7944ef70a5da06bff0b","spotify","Spotify","user"
"37i9dQZF1DWTYPRTIhI2jZ","Honey Dijon's track IDs","<a href=""spotify:artist:0XfQBWgzisaS9ltDV9bXAS"">Honey Dijon</a>'s favorite tracks. Updated regularly. Curated by Honey Dijon. More track IDs <a href=""spotify:genre:track_id"">here</a>.","https://i.scdn.co/image/ab67706f00000003f232f72215aa40bf77e9968e","spotify","Spotify","user"
"37i9dQZF1DWTcqUzwhNmKv","Kickass Metal","BABYMETAL on top of the biggest Metal playlist!","https://i.scdn.co/image/ab67706f00000003959c28ee5f391fe55efc669b","spotify","Spotify","user"
"37i9dQZF1DWTfrr8pte1rT","Rocktronic","Rock with a Drop Cover: ILLENIUM \m/","https://i.scdn.co/image/ab67706f00000003c2dc4e5d8eafc59e89425889","spotify","Spotify","user"
"37i9dQZF1DWTggY0yqBxES","Alternative Hip-Hop","New, leftfield, and for the real hip-hop stans! Cover: Doechii","https://i.scdn.co/image/ab67706f00000003969e277eeaf53352de8b5826","spotify","Spotify","user"
"37i9dQZF1DWTh86g4mGpKZ","Aluna's DJ Mix","The internationally acclaimed singer, songwriter and producer <a href=""spotify:artist:5ITI6SEoUZMIXXkzCfr4oE"">Aluna</a> drops a mix that pays homage to the different variants of dance music while pushing the boundaries of the genre.","https://i.scdn.co/image/ab67706f00000003f82aeea90495b78e366757c8","spotify","Spotify","user"
"37i9dQZF1DWTpHODMtGPJl","DJ Spen DJ Mix: Eye of The Storm","Feel good and dance with Soulful House legend <a herf=""spotify:artist:4kr94nr7SzBRas5Cb3krFZ"">DJ Spen</a> on his new DJ Mix.","https://i.scdn.co/image/ab67706f0000000380ff4cde13593bd4e9db2eb2","spotify","Spotify","user"
"37i9dQZF1DWTtTyjgd08yp","Deep Dark Indie","Hauntingly atmospheric, deeply melodic indie.","https://i.scdn.co/image/ab67706f000000033f61d2c9f774776b80dde4b9","spotify","Spotify","user"
"37i9dQZF1DWU9MwLOqWTux","Idris Elba's DJ Mix","<a href=""spotify:artist:0Dc2rdPzleezxhvQhQbXuS"">Idris Elba</a>'s tantalizing mix demonstrates the renowned actor's talents on the decks.","https://i.scdn.co/image/ab67706f00000003abc4b6fc079d590acaa985e2","spotify","Spotify","user"
"37i9dQZF1DWUBSyNvqfKld","DEAS' track IDs","<a href=""spotify:artist:3sgVVFFM7mom04OAR0eNCL"">DEAS</a>'s favorite tracks. Updated regularly. Curated by DEAS. Discover more track IDs playlists <a href=""spotify:genre:track_id"">here</a>.
","https://i.scdn.co/image/ab67706f00000003f714b00556e9070b1f8ead39","spotify","Spotify","user"
"37i9dQZF1DWUORUyb9eLKN","Qrion's DJ Mix","Emerging DJ & producer <a href=""spotify:artist:0bGDTQ78MVgI5Snqo9KJZw"">Qrion</a> demonstrates her talent with an emotive and mellifluous mix.","https://i.scdn.co/image/ab67706f000000037ce92fc96d7fba91957bf02b","spotify","Spotify","user"
"37i9dQZF1DWUaEbKBollAD","Giorgia Angiuli's track IDs","<a href=""spotify:artist:4iHnLagnnmgiIwMSm1wuTq"">Giorgia Angiuli</a>'s favorite tracks. Updated regularly. Curated by Giorgia Angiuli. More track IDs <a href=""spotify:genre:track_id"">here</a>.","https://i.scdn.co/image/ab67706f000000037ce4ecd8b6cc0908841147fd","spotify","Spotify","user"
"37i9dQZF1DWUbKXPE8a2j2","Mark Knight's DJ Mix","Toolroom's head honcho <a href=spotify:artist:3h11MHQeCrcsUgRRijI1zL"">Mark Knight</a> delivers a driving house mix that will get you groovin'","https://i.scdn.co/image/ab67706f000000038d689cae948b58ae3307dd8e","spotify","Spotify","user"
"37i9dQZF1DWUbycBFSWTh7","Deephouse Delight","Deephouse in the mix for your delight.","https://i.scdn.co/image/ab67706f00000003e4a3f34aa23f7d60908ba5ae","spotify","Spotify","user"
"37i9dQZF1DWUraJYejk11q","Genre Glitch","Instrumental bliss beyond genre classification.","https://i.scdn.co/image/ab67706f000000034abf08ffea59d07bfdbc9e1d","spotify","Spotify","user"
"37i9dQZF1DWUsPVhZLVT7i","Grum's DJ Mix","The Scottish DJ and producer <a href=""spotify:artist:3VEqFWRt47xQAZJMBF3duQ"">Grum</a> shares an intricate mix showcase some of his latest productions. ","https://i.scdn.co/image/ab67706f00000003eb742f6029fc7123afe81ac6","spotify","Spotify","user"
"37i9dQZF1DWV0gynK7G6pD","Classical New Releases","Updated every Friday with the very best classical new releases. Cover: Eric Whitacre","https://i.scdn.co/image/ab67706f00000003cb7ae35b8768cc2ae31d0f95","spotify","Spotify","user"
"37i9dQZF1DWV1OrS6TwOVZ","Folamour's DJ Mix","The musically talented <a href="""">Folamour</a> shares a feel good, groovy mix that will surely lift your spirits!","https://i.scdn.co/image/ab67706f0000000320429f7c06fc808ba3dae3d5","spotify","Spotify","user"
"37i9dQZF1DWVCHIm2MEeIy","Electronic Circus","Time to rave again. ","https://i.scdn.co/image/ab67706f00000003dc1520d65be2826e4303d807","spotify","Spotify","user"
"37i9dQZF1DWVFhnU8yozBd","Sofia Kourtesis track IDs","<a href=""spotify:artist:7wXTWO45lqpUejDkike0Gf"">Sofia Kourtesis</a>'s favorite tracks. Updated regularly. Curated by Sofia Kourtesis. Discover more track IDs playlists <a href=""spotify:genre:track_id"">here</a>.","https://i.scdn.co/image/ab67706f00000003c4052b5e2e968fb391880263","spotify","Spotify","user"
"37i9dQZF1DWVP2LZyJjTuU","AVIRA's DJ Mix","Melodic Techno & Dance Lover  <a href=""spotify:artist:7rznn3BVOuA5jyPB275jmS"">AVIRA</a> join us this week with an enchanting mix.","https://i.scdn.co/image/ab67706f000000033d3461bec8cacc3f1ab04fb2","spotify","Spotify","user"
"37i9dQZF1DWVPkU1Q0FTEV","Fatima Hajji's track IDs","<a href=""spotify:artist:6jZSXmTCxZhFfYELtp78Ci"">Fatima Hajji</a>'s favorite tracks. Updated regularly. Discover more track IDs playlists <a href=""spotify:genre:track_id"">here</a>

","https://i.scdn.co/image/ab67706f00000003a9eb87859000004c9b4f8f7b","spotify","Spotify","user"
"37i9dQZF1DWVXNkY9grbsT","Electronic X","Genre-defying artists pushing boundaries in electronic ambient music. Cover: JakoJako","https://i.scdn.co/image/ab67706f000000038912ff7631c65a1d4b20d764","spotify","Spotify","user"
"37i9dQZF1DWVY4eLfA3XFQ","Operator","Tech house technicians, featuring Noizu & Westend","https://i.scdn.co/image/ab67706f00000003d8cc0851470191f224b6257b","spotify","Spotify","user"
"37i9dQZF1DWVbu3wLXA48X","Indie Shuffle","Current indie tunes from Asia and around the world. Cover: Gorillaz","https://i.scdn.co/image/ab67706f000000031db41dee5246dbb9c9fad4c8","spotify","Spotify","user"
"37i9dQZF1DWVfaWXjwoSGX","kryptogram's DJ Mix","Emerging Chicago-based producer & DJ <a href=""spotify:artist:184mGxeseZkY2w05Nr4Tui"">kryptogram</a> shares his impressive cratedigging skills in his mix.","https://i.scdn.co/image/ab67706f00000003d2b4aea299caa7c8200a6f28","spotify","Spotify","user"
"37i9dQZF1DWVizZkmthjWQ","Anja Schneider's track IDs","<a href=""spotify:artist:0f14r70OISSfJoyqYaHbgV"">Anja Schneider</a>'s favorite tracks. Updated regularly. Curated by Anja Schneider. Discover more track IDs playlists <a href=""spotify:genre:track_id"">here</a>.","https://i.scdn.co/image/ab67706f0000000322e482af926638fcaacfc2b4","spotify","Spotify","user"
"37i9dQZF1DWVqJMsgEN0F4","Alt NOW","Portugal. The Man along with the top Alternative songs of today.","https://i.scdn.co/image/ab67706f0000000330e01b5be60f4e57a5dafe06","spotify","Spotify","user"
"37i9dQZF1DWVrtsSlLKzro","Sad Beats","<a href=""spotify:genre:edm_dance"">electronic</a> melancholy < / 3","https://i.scdn.co/image/ab67706f0000000390954451308db71d0e43a9fa","spotify","Spotify","user"
"37i9dQZF1DWVsUAwZHD4MI","Shygirl's track IDs","<a href=""spotify:artist:3M3wTTCDwicRubwMyHyEDy""> Shygirl</a>'s favorite tracks. Updated regularly. Curated by Shygirl. Discover more track IDs playlists <a href=""spotify:genre:track_id"">here</a>.","https://i.scdn.co/image/ab67706f000000037d12f18f3f605986d4f7b028","spotify","Spotify","user"
"37i9dQZF1DWVtHcSjp0LID","Deep Study","Deep beats to study to.","https://i.scdn.co/image/ab67706f000000036e9e12914e2dd3015a6b9455","spotify","Spotify","user"
"37i9dQZF1DWW2c0C8Vb2IR","All New Jazz","All new, all jazz. Cover: The JuJu Exchange","https://i.scdn.co/image/ab67706f0000000318a78bc179d6273bd3a53151","spotify","Spotify","user"
"37i9dQZF1DWW668oFRU96k","Electro Mix","A selection of new, quality electro sounds from your favorite EDM acts! Cover: Steve Aoki x Galantis x Hayley Kiyoko","https://i.scdn.co/image/ab67706f0000000303b22a1a52259e06f2c30e13","spotify","Spotify","user"
"37i9dQZF1DWW9AqVvhy1Jb","Miss Kittin's track IDs","<a href=""spotify:artist:3QhNv79NoIvarU6N57GBzL"">Miss Kittin</a>'s favourite tracks. Updated regularly. Curated by Miss Kittin. More track IDs <a href=""spotify:genre:track_id"">here</a>.","https://i.scdn.co/image/ab67706f00000003c383ec4105459b1b3f26c6f0","spotify","Spotify","user"
"37i9dQZF1DWWQRwui0ExPn","lofi beats","The chillest beats to help you relax, study, code, and focus.","https://i.scdn.co/image/ab67706f00000003abaf6c3c6a4b29f8a4565a86","spotify","Spotify","user"
"37i9dQZF1DWWY64wDtewQt","phonk","the beat of your drift","https://i.scdn.co/image/ab67706f00000003a1d3de8e9183170f494634cf","spotify","Spotify","user"
"37i9dQZF1DWWbEGrb2ydWx","Logic1000's track IDs","<a href=""spotify:artist:2EFsfh1zewsSWhDINv7j1I"">Logic1000's </a> favourite tracks.  Updated regularly. Curated by Logic1000. More track IDs <a href=""spotify:genre:track_id"">here</a>.","https://i.scdn.co/image/ab67706f000000035bf4ceb8856a3e9f98f97778","spotify","Spotify","user"
"37i9dQZF1DWWmsWPbM2pKT","Darkwave","Obscure, dreamy and nostalgic synth sounds from all over the world. Molchat Doma on cover.","https://i.scdn.co/image/ab67706f00000003f61101edc83fa3e7260bef5c","spotify","Spotify","user"
"37i9dQZF1DWWtqHeytOZ8f","Lava Lamp","Contemplate the universe in a bottle of friendly colored magma.","https://i.scdn.co/image/ab67706f000000035fc579eb8504922d4033606a","spotify","Spotify","user"
"37i9dQZF1DWWvTQHhm7Jtf","Planetary Soul","A pangea of ethnic/futuristic sounds inspired by Brian Eno and Jon Hassell's 'Fourth World Vol 1 - Possible Musics'.","https://i.scdn.co/image/ab67706f00000003bafed7e5e5462ae4c829645c","spotify","Spotify","user"
"37i9dQZF1DWXIcbzpLauPS","The Core","Metalcore at its finest. Cover: Underoath","https://i.scdn.co/image/ab67706f00000003cb9df096983e45179475c9e8","spotify","Spotify","user"
"37i9dQZF1DWXLeA8Omikj7","Brain Food","<a href=""spotify:genre:space:electronica_chill"">Hypnotic electronic</a> for studies and a relax.","https://i.scdn.co/image/ab67706f000000031888f73e300bd0ee976b0180","spotify","Spotify","user"
